id,title,type,description,release_year,age_certification,runtime,genres,production_countries,seasons,imdb_id,imdb_score,imdb_votes,tmdb_popularity,tmdb_score,person_id,name
tm886086,Seized,MOVIE,"Hiding out with his son Taylor on the Mexican coast, Nero hopes to put his violent Special Forces career behind him. But after Nero’s home is attacked and Taylor is abducted, the mysterious Mzamo orders Nero to slaughter the members of three rival crime syndicates. If he fails, Taylor will die. Now, with bullets flying and bodies dropping as Nero completes his mission, he races to find Mzamo’s hideout and seek revenge.",2020,R,85,"['action', 'thriller']",['US'],,tt7221772,5.3,2270.0,12.92,6.6,33881,Isaac Florentine
ts89048,My First First Love,SHOW,"Due to various personal reasons, a group of Yun Tae-o’s friends move into his house, where they experience love, friendship, and everything in between.",2019,PG,48,['drama'],['KR'],2.0,tt8995604,7.5,2246.0,25.264,8.3,1019905,Oh Jin-seok
ts89832,Abyss,SHOW,"After meeting an untimely demise in separate incidents, Cha Min and Go Se-yeon discover they’ve come back to life in new bodies they don’t recognize.",2019,PG,63,"['scifi', 'crime', 'fantasy', 'romance', 'comedy']",['KR'],1.0,tt10055734,7.1,2324.0,15.15,8.3,1962912,Yoo Je-won
ts216493,The Naked Director,SHOW,Follows the story of Toru Muranishi's unusual and dramatic life filled with big ambitions as well as spectacular setbacks in his attempt to turn Japan's porn industry on its head.,2019,MA,50,"['drama', 'comedy']",['JP'],2.0,tt10477528,7.7,6147.0,252.688,7.5,276335,Masaharu Take
tm434830,The Grizzlies,MOVIE,"In a small Arctic town struggling with the highest suicide rate in North America, a group of Inuit students' lives are transformed when they are introduced to the sport of lacrosse.",2019,R,106,"['drama', 'sport']",['CA'],,tt6365796,7.4,2194.0,4.171,7.6,39532,Miranda de Pencier
tm475162,American Woman,MOVIE,"A political activist helps take care of a group of America’s most wanted fugitives — including a well-known, recently radicalized heiress — in this fictionalized reimagining of the Patty Hearst affair.",2019,R,85,['drama'],"['CA', 'US']",,,,,3.54,5.3,85063,Semi Chellas
ts88841,The School Nurse Files,SHOW,"Wielding a light-up sword through the dark corners of a high school, a nurse with an unusual gift protects students from monsters only she can see.",2020,PG,51,"['scifi', 'fantasy', 'comedy', 'drama']",['KR'],1.0,tt12879522,6.4,1195.0,10.551,7.8,113202,Lee Kyoung-mi
tm916997,Work It,MOVIE,A brilliant but clumsy high school senior vows to get into her late father's alma mater by transforming herself and a misfit squad into dance champions.,2020,PG,93,"['comedy', 'music']",['US'],,tt10276470,6.1,13242.0,14.953,7.7,108483,Laura Terruso
tm932595,A Babysitter's Guide to Monster Hunting,MOVIE,"Recruited by a secret society of babysitters, a high schooler battles the Boogeyman and his monsters when they nab the boy she's watching on Halloween.",2020,PG,94,"['fantasy', 'family', 'comedy']",['US'],,tt4844150,5.4,4172.0,39.595,6.2,36471,Rachel Talalay
tm889679,Roped,MOVIE,A star cowboy in a traveling rodeo gets thrown off course when he falls in love with the daughter of a tough-minded town councilman.,2020,PG,90,"['drama', 'romance', 'family', 'comedy']",['US'],,tt8523028,5.4,1436.0,10.847,6.3,127816,Shaun Paul Piccinino
tm502151,A Remarkable Tale,MOVIE,A town at the edge of the missing take desperate measures to avoid it.,2019,PG,93,"['comedy', 'drama', 'european']",['ES'],,tt8296660,5.3,1251.0,7.463,5.7,200401,Marina Seresesky
ts223242,Was It Love?,SHOW,"After 14 years devoid of romance, a struggling movie producer and single mom faces the unexpected arrival of 4 men into her life—an author, an actor, a CEO, and a younger man—who might just revive her dormant desire for love.",2020,MA,69,"['drama', 'comedy', 'romance']",['KR'],1.0,tt12525622,7.1,907.0,4.721,8.1,760798,Kim Do-hyung
tm927286,Making The Witcher,MOVIE,"Journey into the extraordinary world of ""The Witcher"" — from casting the roles to Jaskier's catchy song — in this behind-the-scenes look at the series. Go behind the monsters, the ballads and every bit of magic that went into bringing The Witcher's Continent to life.",2020,PG,37,['documentation'],['GB'],,tt12987838,6.8,456.0,19.659,7.6,1941239,Nathan Wiley
tm881162,Athlete A,MOVIE,Follow the Indianapolis Star reporters that broke the story about USA Gymnastics doctor Larry Nassar's abuse and hear from gymnasts.,2020,PG,104,"['documentation', 'crime', 'sport']",['US'],,tt11905462,7.6,10861.0,11.88,7.7,232480,Bonni Cohen
tm881162,Athlete A,MOVIE,Follow the Indianapolis Star reporters that broke the story about USA Gymnastics doctor Larry Nassar's abuse and hear from gymnasts.,2020,PG,104,"['documentation', 'crime', 'sport']",['US'],,tt11905462,7.6,10861.0,11.88,7.7,147323,Jon Shenk
ts268890,Lovestruck in the City,SHOW,"Heart stolen by a free-spirited woman after a beachside romance, a passionate architect sets out to reunite with her on the streets of Seoul.",2020,PG,30,"['drama', 'romance']",['KR'],1.0,tt13394544,7.6,2372.0,18.949,7.763,1496035,Park Shin-woo
tm835869,Jarhead: Law of Return,MOVIE,"Major Ronan Jackson, an accomplished fighter pilot for the Israel Defense Forces and son of a U.S. Senator, is shot down while flying through Syrian airspace. After miraculously surviving the crash, Jackson is taken captive by a group of Hezbollah militiamen. A squad of elite soldiers, led by Gunnery Sergeant Dave Torres, risk their own lives in the hopes of saving an ally they've never met.",2019,R,103,['war'],"['IL', 'US']",,tt10767720,5.6,,21.561,6.543,12065,Don Michael Paul
ts89291,Mythomaniac,SHOW,"Burned out and taken for granted, a working mom suspects her partner is cheating, so to win back his attentions, she feigns a medical diagnosis.",2019,MA,46,"['comedy', 'drama']",['FR'],2.0,tt10677432,6.8,1303.0,3.965,6.3,352698,Fabrice Gobert
ts224891,Followers,SHOW,"When an aspiring actress hits it big thanks to a candid Instagram post, the lives of several Tokyo women cross as they struggle to define happiness IRL.",2020,MA,40,"['drama', 'comedy']",['JP'],1.0,tt16391360,,,5.149,7.2,319878,Mika Ninagawa
ts218176,The Big Show Show,SHOW,"When Big Show's teenage daughter comes to live with him and his wife and two other daughters, he quickly becomes outnumbered and outsmarted. Despite being 7 feet tall and weighing 400 pounds, he is no longer the center of attention.",2020,PG,26,"['comedy', 'family']",['US'],1.0,tt10726356,6.3,2426.0,8.046,7.5,917764,Jody Margolin Hahn
ts245653,The Club,SHOW,"Dealing with the pressure of his father and his need to be someone, Pablo decides to start a new shady, tricky business that will lead him to some happy but tragic experiences.",2019,MA,34,"['comedy', 'drama']",['MX'],1.0,,,,12.778,7.6,1255988,Camila Ibarra
ts245653,The Club,SHOW,"Dealing with the pressure of his father and his need to be someone, Pablo decides to start a new shady, tricky business that will lead him to some happy but tragic experiences.",2019,MA,34,"['comedy', 'drama']",['MX'],1.0,,,,12.778,7.6,1140351,Raúl Caballero
ts245653,The Club,SHOW,"Dealing with the pressure of his father and his need to be someone, Pablo decides to start a new shady, tricky business that will lead him to some happy but tragic experiences.",2019,MA,34,"['comedy', 'drama']",['MX'],1.0,,,,12.778,7.6,1255672,Agustin Ortiz
tm816992,Double World,MOVIE,"Seeing the neighboring country become more and more powerful, a warlord organizes a competition to reveal the best warriors. A young man is eager to bring honour to his clan.",2020,PG,110,"['fantasy', 'action']","['CN', 'HK']",,tt10508838,6.1,4160.0,14.66,6.7,39469,Teddy Chan
ts255809,Carmel: Who Killed Maria Marta?,SHOW,"Documentary series on the circumstances surrounding the death of María Marta García Belsunce, one of the most controversial criminal cases in Argentina.",2020,PG,58,"['documentation', 'crime']",['AR'],1.0,tt13244092,7.0,2463.0,33.319,7.5,690250,Alejandro Hartmann
tm854278,Rogue City,MOVIE,"Caught in the crosshairs of police corruption and Marseille’s warring gangs, a loyal cop must protect his squad by taking matters into his own hands.",2020,PG,116,"['crime', 'thriller', 'action', 'drama']",['FR'],,,,,10.026,5.863,35712,Olivier Marchal
ts185885,Oktoberfest: Beer & Blood,SHOW,"In 1900, A rich newcomer with a shady past arrives in Munich determined to crash the local Oktoberfest with his own brewery. But when his daughter falls in love with the heir to a rival brewery, a violent chain of events is unleashed that will threaten both families' futures.",2020,MA,48,"['drama', 'history', 'thriller']",['DE'],1.0,tt10244612,6.8,2177.0,6.856,7.0,118978,Hannu Salonen
tm844250,Ala Vaikunthapurramuloo,MOVIE,"Fate plays a vital role in connecting the life of Bantu, a son who seeks validation from his cold-hearted father with the life of Raj, whose millionaire father wishes that he was more assertive.",2020,PG,165,"['action', 'drama', 'comedy']",['IN'],,tt9537292,7.3,17029.0,9.691,6.8,226574,Trivikram Srinivas
tm941382,Stand by Me Doraemon 2,MOVIE,"She and her beloved Shizuka are finally married! Nobita's childhood dream was supposed to come true on his wedding day, but for some reason, Nobita doesn't show up... One of the most popular episodes from the original story transcends time and space, and leads to Nobita's future. Doraemon and Nobita's great adventure begins in order to fulfill his grandmother's wish to see his bride at first sight. This is a story of tears and bonds, set in the past, present and future.",2020,PG,96,"['scifi', 'animation', 'comedy', 'drama', 'family', 'fantasy']",['JP'],,tt13428402,7.5,3791.0,17.83,7.6,273840,Ryuichi Yagi
tm941382,Stand by Me Doraemon 2,MOVIE,"She and her beloved Shizuka are finally married! Nobita's childhood dream was supposed to come true on his wedding day, but for some reason, Nobita doesn't show up... One of the most popular episodes from the original story transcends time and space, and leads to Nobita's future. Doraemon and Nobita's great adventure begins in order to fulfill his grandmother's wish to see his bride at first sight. This is a story of tears and bonds, set in the past, present and future.",2020,PG,96,"['scifi', 'animation', 'comedy', 'drama', 'family', 'fantasy']",['JP'],,tt13428402,7.5,3791.0,17.83,7.6,102077,Takashi Yamazaki
tm571805,Otherhood,MOVIE,"A grounded, soulful, celebratory comedy about three mothers and their adult sons. The film explores the stage after motherhood, Otherhood, when you have to redefine your relationship with your children, friends, spouse, and most importantly, yourself.",2019,R,100,['comedy'],"['US', 'GB']",,tt4180560,6.1,11275.0,9.31,6.2,123043,Cindy Chupack
tm931330,BLACKPINK: Light Up the Sky,MOVIE,Record-shattering Korean girl band BLACKPINK tell their story —  and detail the hard fought journey of the dreams and trials behind their meteoric rise.,2020,PG,79,"['documentation', 'music']",['US'],,tt13058290,7.3,6427.0,10.809,8.4,240568,Caroline Suh
ts89656,The Legend of White Snake,SHOW,"Provoked by the actions of a seemingly sly human, an ancient snake spirit takes on a human form, in order to prove him a fraud. Convinced she’s doing the world a favor, Bai Su Zhen challenges Xu Xuan to a contest of skill but what starts as a heated rivalry soon turns to burning passion. Faced with opposition from every side, Bai Su Zhen and Xu Xuan’s love is put to the test time and time again.",2019,PG,46,"['drama', 'scifi', 'fantasy']",['CN'],1.0,tt10628250,7.3,237.0,8.369,8.2,1989175,지뢰
ts217389,Masaba Masaba,SHOW,"Real life mom-daughter duo Neena and Masaba Gupta play versions of themselves in this playful, fictional peek into their lives in fashion and film.",2020,MA,28,"['comedy', 'drama']",['IN'],2.0,tt10655506,6.7,1760.0,8.408,9.0,299824,Sonam Nair
tm898169,If Anything Happens I Love You,MOVIE,Grieving parents journey through an emotional void as they mourn the loss of a child in the aftermath of a tragic school shooting.,2020,PG,12,"['drama', 'animation']",['US'],,,,,10.718,7.8,201464,Michael Govier
tm898169,If Anything Happens I Love You,MOVIE,Grieving parents journey through an emotional void as they mourn the loss of a child in the aftermath of a tragic school shooting.,2020,PG,12,"['drama', 'animation']",['US'],,,,,10.718,7.8,589225,Will McCormack
tm894619,Feel the Beat,MOVIE,"After failing to make it on Broadway, April returns to her hometown and reluctantly begins training a misfit group of young dancers for a competition.",2020,G,107,"['comedy', 'drama', 'family']","['US', 'CA']",,tt10714856,6.3,10967.0,18.004,7.7,375672,Elissa Down
tm458893,"Oh, Ramona!",MOVIE,"Oh, Ramona! seeks the transformation of Andrew from a teenager into an adult who lives candidly and selflessly his first love story, innocent and uninvolved, alternating with the second, intense and insane story, incapable of making a choice. Oh, Ramona! is the cinematic rewriting of Andrei Ciobanu's book ""Suge-o, Ramona!"".",2019,R,109,"['comedy', 'romance', 'european']",['RO'],,tt7200946,4.8,8895.0,20.224,5.7,281619,Cristina Jacob
ts222049,Who Killed Malcolm X?,SHOW,Activist Abdur-Rahman Muhammad begins his own investigation into the perplexing details surrounding the assassination of civil rights leader Malcolm X.,2019,MA,43,"['crime', 'history', 'documentation']",['US'],1.0,tt10948316,7.6,2152.0,2.1,7.5,414974,Phil Bertelsen
ts222049,Who Killed Malcolm X?,SHOW,Activist Abdur-Rahman Muhammad begins his own investigation into the perplexing details surrounding the assassination of civil rights leader Malcolm X.,2019,MA,43,"['crime', 'history', 'documentation']",['US'],1.0,tt10948316,7.6,2152.0,2.1,7.5,355324,Rachel Dretzin
ts237071,The Forest of Love: Deep Cut,SHOW,Nothing's as it seems when a charismatic conman and an aspiring film crew delve into the lives of two emotionally scarred women.,2020,MA,40,"['drama', 'crime', 'horror', 'thriller']",['JP'],1.0,tt12079236,6.8,453.0,6.072,7.0,57821,Sion Sono
tm973536,Kevin Hart: Zero F**ks Given,MOVIE,"Kevin Hart serves up laughs and brick oven pizza from the comfort of his home, and dishes on male group chats, sex after 40 and life with COVID-19.",2020,R,69,['comedy'],['US'],,tt13433082,6.0,3422.0,5.211,7.0,51574,Leslie Small
ts191121,Reality Z,SHOW,"A zombie apocalypse that imprisons participants and producers of a reality show called Olimpo, The House of the Gods. The studio becomes a shelter for those who seek salvation in Rio de Janeiro where chaos and hopelessness begin to rule.",2020,MA,31,"['comedy', 'horror', 'scifi']",['BR'],1.0,tt10241238,5.6,2487.0,11.161,6.8,11209,Cláudio Torres
ts241460,Whispers,SHOW,"When suspicions grow around the death of their patriarch, an affluent family begin to peel back the truth as dark secrets come to light.",2020,PG,42,"['thriller', 'drama']",['SA'],2.0,,,,1.835,8.3,1560830,Hana Al Omair
ts224164,Night on Earth,SHOW,"This nature series’ new technology lifts night’s veil to reveal the hidden lives of the world’s creatures, from lions on the hunt to bats on the wing.",2020,PG,49,['documentation'],['GB'],1.0,,,,10.309,7.4,1736595,Peter Fison
ts224164,Night on Earth,SHOW,"This nature series’ new technology lifts night’s veil to reveal the hidden lives of the world’s creatures, from lions on the hunt to bats on the wing.",2020,PG,49,['documentation'],['GB'],1.0,,,,10.309,7.4,1853495,Jo Harvey
ts224164,Night on Earth,SHOW,"This nature series’ new technology lifts night’s veil to reveal the hidden lives of the world’s creatures, from lions on the hunt to bats on the wing.",2020,PG,49,['documentation'],['GB'],1.0,,,,10.309,7.4,1463117,Hannah Hoare
ts224164,Night on Earth,SHOW,"This nature series’ new technology lifts night’s veil to reveal the hidden lives of the world’s creatures, from lions on the hunt to bats on the wing.",2020,PG,49,['documentation'],['GB'],1.0,,,,10.309,7.4,342224,Ingrid Kvale
ts224164,Night on Earth,SHOW,"This nature series’ new technology lifts night’s veil to reveal the hidden lives of the world’s creatures, from lions on the hunt to bats on the wing.",2020,PG,49,['documentation'],['GB'],1.0,,,,10.309,7.4,842610,Bill Markham
ts224164,Night on Earth,SHOW,"This nature series’ new technology lifts night’s veil to reveal the hidden lives of the world’s creatures, from lions on the hunt to bats on the wing.",2020,PG,49,['documentation'],['GB'],1.0,,,,10.309,7.4,1853534,Alex Minton
ts224164,Night on Earth,SHOW,"This nature series’ new technology lifts night’s veil to reveal the hidden lives of the world’s creatures, from lions on the hunt to bats on the wing.",2020,PG,49,['documentation'],['GB'],1.0,,,,10.309,7.4,1050822,Mateo Willis
tm886283,Legacy of Lies,MOVIE,An ex-MI6 agent is thrown back into the world of espionage and high stakes to uncover the shocking truth about operations conducted by unknown secret services.,2020,R,101,"['thriller', 'action']","['NL', 'PL', 'UA', 'GB', 'US']",,tt6834916,5.0,3493.0,10.179,5.6,380904,Adrian Bol
ts222606,Black Dog,SHOW,"Ko Ha-Neul dreamed of becoming a teacher, due to a teacher who helped her when she was young. Ko Ha-Neul now begins work as a temporary teacher at a private high school. While working there, she interacts with many people, including teachers Park Sung-Soon and Do Yeon-Woo. Both of whom are dedicated to their teaching jobs. Meanwhile, Ko Ha-Neul faces different problems at the school. As she works through those problems, Ko Ha-Neul grows as a person and a teacher.",2019,PG,80,"['drama', 'action']",['KR'],1.0,tt11377920,7.6,176.0,5.171,9.1,2000216,Hwang Joon-Hyuk
tm464888,Love Aaj Kal,MOVIE,"When professional ambitions clash with personal feelings for a modern-day couple, a love story from a bygone era may offer some wisdom.",2020,PG,141,"['romance', 'comedy', 'drama']",['IN'],,tt1275863,6.8,16075.0,3.983,6.1,53156,Imtiaz Ali
tm880059,All Day and a Night,MOVIE,A young man who committed a homicide deals with the repercussions of his action.,2020,R,121,['drama'],['US'],,tt3993886,5.9,3752.0,7.586,6.2,182854,Joe Robert Cole
tm933639,Wish Upon a Unicorn,MOVIE,"Two children discover that their mother is gone. The youngest of the pair, adventurer and upcomming singer, Long Johnson forces his older sister, Lily Johnson, to hunt down a unicorn with magical blood.",2020,PG,93,"['fantasy', 'family']",['US'],,tt10798660,5.3,183.0,22.103,7.1,11709,Steve Bencich
tm455410,Grand-Daddy Day Care,MOVIE,A man has to figure out a way to make extra money when his father-in-law moves in.,2019,PG,91,"['comedy', 'family']",['FR'],,tt8749922,4.9,875.0,6.649,6.6,49351,Ron Oliver
ts104485,The Stranded,SHOW,"When a tsunami strands dozens of teens on an island at their private school, they soon realize no rescuers are coming and they must save themselves.",2019,MA,49,"['drama', 'action']",['TH'],1.0,tt9310400,6.2,1279.0,14.772,7.2,62200,Sophon Sakdaphisit
ts88133,Well-Intended Love,SHOW,"In order to receive a bone marrow transplant quicker and be able to continue her career as an actress, Xia Lin enters into a secret marriage with Ling Yi Zhou, the CEO of a company. Despite the conspiracies and misunderstandings they encounter, the two find true love.",2019,PG,45,"['drama', 'romance']",['CN'],2.0,tt9886950,7.2,1466.0,14.059,7.8,962815,Wu Qiang
tm857921,The Present,MOVIE,"On his wedding anniversary, Yusef and his young daughter set out in the West Bank to buy his wife a gift. Between soldiers, segregated roads and checkpoints, how easy would it be to go shopping?",2020,PG,24,['drama'],"['QA', 'PS']",,tt11474480,,,2.628,7.0,1353965,Farah Nabulsi
ts268758,Mismatched,SHOW,"After a disastrous set-up by their families, two teens strike up a tentative friendship at their summer program - but deeper feelings aren't far behind.",2020,MA,33,"['comedy', 'drama', 'romance']",['IN'],1.0,tt12719250,5.5,3712.0,3.402,6.8,63464,Akarsh Khurana
tm823302,Alice Júnior,MOVIE,"This is the story of Alice Junior, a transgender girl full of life, who wants to give her first kiss, but first, she just wants to be who she really is.",2019,PG,90,"['romance', 'comedy', 'drama', 'animation']",['BR'],,tt8217188,6.8,541.0,2.977,6.8,1264101,Gil Baroni
ts225379,The Good Detective,SHOW,"A drama about the race between people who want to get closer to the truth and those who want to cover it up. Jang Seung Jo will take on the role of Oh Ji Hyuk, an elite detective of nine years who does not share his feelings with others due to pain he experienced when he was young. He is not swayed by money and power, even with the huge wealth he inherited from his uncle.",2020,MA,65,"['drama', 'thriller']",['KR'],2.0,,,,7.633,8.6,1340705,Cho Nam-guk
tm889629,Lady Driver,MOVIE,"When a rebellious teen embarks on a solo summer journey to connect with her roots, she finds herself in a new world, geared up for the ride of her life, and discovers she had the drive in her all along.",2020,PG,104,"['drama', 'sport']",['US'],,tt7562334,5.7,1538.0,13.497,6.3,127816,Shaun Paul Piccinino
tm474548,Good Sam,MOVIE,A news reporter looks into who has been anonymously leaving large cash gifts on random doorsteps in New York.,2019,PG,90,"['romance', 'drama', 'comedy']",['US'],,tt9032888,5.7,2951.0,8.029,6.0,167243,Kate Miles Melville
ts100354,Monzón: A Knockout Blow,SHOW,The story about Argentinian boxer Carlos Monzón in his career and life in prison.,2019,MA,45,"['sport', 'crime', 'drama', 'history']",['AR'],1.0,tt9852660,7.9,744.0,3.878,8.3,1147388,Jesús Braceras
ts100354,Monzón: A Knockout Blow,SHOW,The story about Argentinian boxer Carlos Monzón in his career and life in prison.,2019,MA,45,"['sport', 'crime', 'drama', 'history']",['AR'],1.0,tt9852660,7.9,744.0,3.878,8.3,293294,Gabriel Nicoli
ts225647,Graceful Friends,SHOW,"A group of friends gets intertwined with the death of their professor twenty years ago. Ironically, now in their 40s, they get tangled once again in one man's death. Ahn Goong Chul is a man of success who is married to a doctor and is a director at a popular chicken franchise. One day, he and his wife become suspects in a murder. Through the misunderstandings and suspicion between Ahn Goong Chul and his wife Nam Jung Hae, their relationship starts to deteriorate as secrets and shocking events unfold. Amid the chaos, Ahn Goong Chul desperately struggles to protect his family.",2020,MA,68,"['drama', 'crime']",['KR'],1.0,,,,3.974,8.8,255818,Song Hyun-wook
ts225647,Graceful Friends,SHOW,"A group of friends gets intertwined with the death of their professor twenty years ago. Ironically, now in their 40s, they get tangled once again in one man's death. Ahn Goong Chul is a man of success who is married to a doctor and is a director at a popular chicken franchise. One day, he and his wife become suspects in a murder. Through the misunderstandings and suspicion between Ahn Goong Chul and his wife Nam Jung Hae, their relationship starts to deteriorate as secrets and shocking events unfold. Amid the chaos, Ahn Goong Chul desperately struggles to protect his family.",2020,MA,68,"['drama', 'crime']",['KR'],1.0,,,,3.974,8.8,1964270,박소연
ts86928,The Crowned Clown,SHOW,"The story takes place at a time in Joseon history, when upheaval and power struggles surrounding the throne had reached extreme levels. In order to escape those who plan to assassinate him, the king puts a clown, who looks exactly like him, on the throne.",2019,PG,75,"['drama', 'action', 'history', 'romance']",['KR'],1.0,tt9266592,8.0,938.0,6.289,8.7,1790441,Kim Hee-won
tm960414,A California Christmas,MOVIE,"With his carefree lifestyle on the line, a wealthy charmer poses as a ranch hand to get a hardworking farmer to sell her family's land before Christmas.",2020,PG,106,"['romance', 'comedy', 'drama']",['US'],,tt13055780,5.8,9831.0,11.246,6.4,127816,Shaun Paul Piccinino
ts87698,Examination of Conscience,SHOW,"Allegations of child sexual abuse in Spain's Catholic institutions are examined in interviews with survivors, clergy, journalists and other experts.",2019,MA,52,"['documentation', 'crime', 'history']",['ES'],1.0,tt9584024,7.8,427.0,2.183,8.8,119435,Albert Solé
ts91034,Leila,SHOW,"In the forgotten margins of the segregated communities of a dystopian future, a woman searches for the daughter that she lost upon her arrest years ago.",2019,MA,46,"['scifi', 'war', 'drama']",['IN'],1.0,tt9337588,4.9,8906.0,2.799,7.0,387493,Shanker Raman
ts91034,Leila,SHOW,"In the forgotten margins of the segregated communities of a dystopian future, a woman searches for the daughter that she lost upon her arrest years ago.",2019,MA,46,"['scifi', 'war', 'drama']",['IN'],1.0,tt9337588,4.9,8906.0,2.799,7.0,74176,Deepa Mehta
ts91034,Leila,SHOW,"In the forgotten margins of the segregated communities of a dystopian future, a woman searches for the daughter that she lost upon her arrest years ago.",2019,MA,46,"['scifi', 'war', 'drama']",['IN'],1.0,tt9337588,4.9,8906.0,2.799,7.0,243311,Pawan Kumar
ts235979,The Victims' Game,SHOW,"After discovering his estranged daughter's link to mysterious murders, a forensic detective with Asperger's syndrome risks everything to solve the case.",2020,MA,59,"['drama', 'crime', 'thriller']",['TW'],1.0,tt12079212,7.3,1408.0,3.275,7.5,1504442,David Chuang
ts235979,The Victims' Game,SHOW,"After discovering his estranged daughter's link to mysterious murders, a forensic detective with Asperger's syndrome risks everything to solve the case.",2020,MA,59,"['drama', 'crime', 'thriller']",['TW'],1.0,tt12079212,7.3,1408.0,3.275,7.5,1427892,Chen Kuan-chung
