id,title,type,description,release_year,age_certification,runtime,genres,production_countries,seasons,imdb_id,imdb_score,imdb_votes,tmdb_popularity,tmdb_score,person_id,name
tm172883,Game,MOVIE,"Four strangers are invited by the reclusive Kabir Malhotra, to his private island of Samos, Greece. They don't know each other and they don't know him ... and by the next morning they will wish they had never come.",2011,PG,135,"['thriller', 'action', 'crime', 'drama', 'european']",['IN'],,tt1772872,5.2,2353.0,4.612,5.2,65751,Abhinay Deo
tm74031,Kyaa Super Kool Hain Hum,MOVIE,An aspiring actor and a struggling DJ team up to pursue the ladies they love and a diamond that rightfully belongs to their oversexed dog.,2012,R,137,"['drama', 'comedy']",['IN'],,tt2027138,5.0,3926.0,3.166,5.1,1132571,Sachin Yardi
tm42306,Aiyyaa,MOVIE,"Meenakshi, a Marathi gal with an ultra-sensitive sense of smell, lives her life in her dreams, dancing and enacting her favourite actresses Sridevi, Madhuri and Juhi. Not believing in arranged marriages, Meenakshi awaits her prince when she comes across Tamil artist Surya, to whom she is strangely attracted to.",2012,G,146,"['romance', 'comedy']",['IN'],,tt2255934,4.3,1889.0,4.582,5.1,194555,Sachin Kundalkar
ts32561,Office Girls,SHOW,"Office Girls, is a 2011 Taiwanese drama starring Roy Chiu, Alice Ko, James Wen, Tia/Keiko, and Patrick Lee. It started filming in July 2011.

It was first broadcast in Taiwan on free-to-air Taiwan Television every Sunday at 22:00 from 21 August 2011, and cable TV SET Metro every Saturday at 22:00 from 28 August 2011.",2011,PG,46,"['comedy', 'drama', 'romance']",['TW'],1.0,tt4381290,6.8,153.0,9.047,7.3,658434,Fu-chun Hsu
tm39606,Tere Naal Love Ho Gaya,MOVIE,"In a quaint village of Haryana lives Miny, a free-spirited tomboy who instantly wins your heart with her bubbly personality. Her father, Bhatti, runs an auto-rickshaw business and is adamant to marry her off against her liking to Sunny. The male protagonist Viren, is a humble and ambitious rickshaw driver working for Miny's father. Bhatti, insecure about Viren's success, sells of all the rickshaws where Viren had carefully stashed his life savings. In an attempt to recover his money from Bhatti, Viren storms into Miny's engagement with fury. This gives Miny the perfect opportunity to escape her marriage and so she stages a kidnap. However, the kidnap goes all wrong and she and Viren land up in Viren's family mansion. Eventually, Miny's father arrives with the ransom that she had asked for and takes her back home. Back in Punjab, while she is being married off to Sunny...",2012,PG,126,"['drama', 'comedy', 'romance']",['IN'],,tt2130242,5.8,4381.0,3.262,6.2,240088,Mandeep Kumar
tm167241,Ragini MMS,MOVIE,"Out to relax and have fun at a farmhouse, a couple experience horror at the hands of an unknown entity",2011,PG,93,"['drama', 'horror', 'thriller']",['IN'],,tt1890513,5.1,2654.0,2.033,3.8,238075,Pawan Kripalani
ts37864,The Glamorous Imperial Concubine,SHOW,"Ma Fuya is a princess of the Chu state in 10th-century imperial China during the Five Dynasties and Ten Kingdoms period. In this time of warring kingdoms and political upheaval, Fuya's uncle usurps the throne and brutally kills her father. Ma Fuya is left an orphan, and she escapes with the help of a eunuch. She also falls in love with Meng Qiyou, the Prince of Later Shu. He instead uses her as a political tool, and he brings her back into his kingdom. Many of his brothers are attracted to her, such as Meng Qixing and Meng Qiyun. Due to her resemblance as Meng Qiyun's mother, the Emperor also falls in love with her. Ma Fuya is forced to marry the Emperor, but the procession is interrupted by Liu Liancheng.",2011,PG,47,"['drama', 'history', 'romance']",['CN'],1.0,tt2272555,6.8,156.0,3.417,7.0,2455820,Lin Feng
tm166810,Michael,MOVIE,"After accidentally shooting a 12-year-old boy, a dedicated cop is removed from his position. Forced to take work at a local cinema and beginning to lose his eyesight, he struggles to provide for his son.",2011,PG,97,"['drama', 'thriller']",['IN'],,tt1754202,5.3,168.0,0.823,5.5,235916,Ribhu Dasgupta
tm164090,Lavell Crawford: Can a Brother Get Some Love?,MOVIE,"""Last Comic Standing"" runner-up Lavell Crawford lords over a hometown crowd at St. Louis's Orpheum Theatre, raking in the love -- and the laughs. Jokes cover the hilarity of presidential politics and the social scene in heaven.",2011,R,90,"['comedy', 'documentation']",['US'],,tt2084872,6.9,234.0,2.301,6.5,146832,Michael Drumm
tm37175,Jeff Dunham: Minding the Monsters,MOVIE,"Stand-up comedian and ventriloquist Jeff Dunham. Enter the ultimate hunted house where Walter transforms into something grumpier than he already is! Watch Bubba J. rise from the dead! Meet Peanut's alter ego, The Purple Venger of the Night, and his spicy sidekick! and witness Achmed litterally dressed to kill in an outfit terrify the most terrifying terrorist!",2012,PG,80,['comedy'],['US'],,tt2461736,7.0,1416.0,2.314,6.2,65462,Manny Rodriguez
tm66725,Kalakalappu,MOVIE,"A man struggles to save his family-owned restaurant as it is running in loses. He soon falls for a health inspector keen on shutting down the place. When his brother enters the scene, things get worse.",2012,G,149,['comedy'],['IN'],,tt2262126,6.9,1398.0,2.488,6.5,235458,Sundar C
ts44064,Drunken to Love You,SHOW,"Love You, is a 2011 Taiwanese drama starring Joseph Chang, Rainie Yang, Kingone Wang, Tiffany Hsu, Alien Huang and Tom Price. It is the second installment of the Fated to Love You trilogy. It started filming in January 2011 and wrapped on 30 April.

It was first broadcast in Taiwan on free-to-air Taiwan Television from 17 April 2011, every Sunday at 22:00 and cable TV SET Metro from 23 April 2011, every Saturday at 21:00.

Love You was nominated in 2011 for four awards at the 46th Golden Bell Awards, including Best Leading Actor in a Television Series for Joseph Chang, Best Directing for a Television Series for Ming-chang Chen and Best Television Series.",2011,PG,46,"['comedy', 'drama', 'romance']",['TW'],1.0,tt2473936,6.5,114.0,3.195,8.0,2066574,Chen Ming Zhang
tm172353,Bbuddah Hoga Terra Baap,MOVIE,"After a series of bomb blasts in Mumbai, ACP Karan Malhotra announces that he will bring in the culprits responsible within a very short period of time as well attempts to convince his college sweetheart, Tanya P. Nath, to marry him. He then sets about interrogating several suspects so much so that an underworld gangster, Kabir, is compelled to hire an assassin to do away with him. The potential killer, Viju, is an uptight older ex-convict as well as a former gangster, who now runs a pub in Paris, and is willing to kill Karan. As he sets about this gruesome task, he comes across an old flame, Kamini, as well as his estranged wife, Sita - and it is these encounters that may well be the turning point in this life that may convince him to leave the bombs and Bandooks behind and spend the rest of his life praying and watching the Bhakti Channel.",2011,PG,117,"['thriller', 'action', 'comedy', 'crime']",['IN'],,tt1869296,5.6,2908.0,2.229,5.2,104668,Puri Jagannath
tm34746,Luv Shuv Tey Chicken Khurana,MOVIE,"On-the-run from the London mafia, Omi returns to his ancestral village – a place he’d flown from with his grandad’s money and grander ‘London Dreams’. Will Omi be able to hide his failures while chasing love, and the lost recipe of the infamous dish, ‘Chicken Khurana’?",2012,PG,140,['comedy'],['IN'],,tt2186933,6.6,3925.0,2.564,6.3,144392,Sameer Sharma
tm53360,Blood Money,MOVIE,"In South Africa, a young man living with his wife becomes embroiled in an illegal diamond business and with time finds his life changing.",2012,PG,110,"['thriller', 'drama', 'crime', 'action']",['IN'],,tt2246595,5.0,1480.0,31.391,6.1,184686,Vishal Mahadkar
tm180532,Shaitan,MOVIE,Five substance-abusing friends decide to fake a kidnapping in order to bribe a police constable for covering-up a hit-and-run accident.,2011,PG,121,"['drama', 'thriller', 'action', 'crime']",['IN'],,tt1836912,7.2,8475.0,4.098,6.4,233825,Bejoy Nambiar
tm34142,Department,MOVIE,A police inspector recruits a suspended cop for a specialized task force to battle organized crime.,2012,R,141,"['action', 'thriller', 'crime']",['IN'],,tt2186731,3.2,1058.0,2.125,6.0,57119,Ram Gopal Varma
ts27875,Masha's tales,SHOW,"Masha, it turns out, loves to tell stories! And she tells them, as would any child with creativity, a little in her own way - because children see the world, not as we, adults.",2012,G,5,"['animation', 'family']",['RU'],2.0,tt3840498,6.4,92.0,5.32,7.5,724828,Oleg Kuzovkov
tm38331,The Mistress,MOVIE,"A young woman is torn between the affections of her two lovers. One is a young bachelor who brings passion into her life. The other is a married man who has kept her as his mistress for years. Architect JD has a chip on his shoulder about his father Rico never really accepting him as his son. Seamstress Sari struggles to take care of her family. The two meet by chance, and JD aggressively pursues Saris affections. Though the two are clearly a good match, there is a problem standing in the way of their bliss: Sari is the mistress of JDs father. Against his better judgment, JD continues to court Sari even after finding out this difficult fact. He hides his true identity as Ricos son, and fights to win Saris heart.",2012,PG,125,"['romance', 'drama']",['PH'],,tt2389344,6.3,361.0,2.635,5.9,200814,Olivia M. Lamasan
tm481620,The Rise of Kirmada,MOVIE,"Kirmada, gets powerful by taking power of Shaitan, plans vengeance & tries to put troubles in Bheem and his friend's journey. However they manage to reach but things take a turn when the evil troops arrive and attack Bheem and his friends.",2012,G,68,['animation'],['IN'],,tt6543070,8.2,67.0,2.328,8.0,304814,Rajiv Chilaka
tm182026,Zokkomon,MOVIE,"An orphan is abused and abandoned, believed to be dead, and upon his return is first feared as a ghost, and then projected as a superhero.",2011,PG,109,"['fantasy', 'drama', 'family', 'action']",['IN'],,tt1605790,4.0,411.0,1.927,6.8,337742,Satyajit Bhatkal
tm235979,My Friend Pinto,MOVIE,"Sweet, honest, and optimistic Michael Pinto has a knack for finding trouble. The search for a childhood friend leads him to the big city, and into an outlandish adventure.",2011,PG,115,"['comedy', 'crime', 'drama']",['IN'],,tt1512220,5.3,392.0,1.489,5.0,347552,Raaghav Dar
tm140389,Paddington,MOVIE,"A young Peruvian bear travels to London in search of a new home. Finding himself lost and alone at Paddington Station, he meets the kindly Brown family.",2014,PG,95,"['comedy', 'family', 'fantasy', 'animation', 'european']","['US', 'FR', 'GB']",,tt1109624,7.2,113735.0,34.868,7.1,16115,Paul King
tm150928,It Follows,MOVIE,"When carefree teenager Jay sleeps with her older boyfriend for the first time, she learns that she is the latest recipient of a fatal curse that is passed from victim to victim via sexual intercourse. Death, Jay learns, will creep inexorably toward her as either a friend or a stranger. Jay's friends don't believe her seemingly paranoid ravings, until they too begin to see the phantom assassins and band together to help her defend herself.",2014,R,101,"['horror', 'thriller']",['US'],,tt3235888,6.8,236513.0,123.984,6.559,1168,David Robert Mitchell
tm140877,The Imitation Game,MOVIE,"Based on the real life story of legendary cryptanalyst Alan Turing, the film portrays the nail-biting race against time by Turing and his brilliant team of code-breakers at Britain's top-secret Government Code and Cypher School at Bletchley Park, during the darkest days of World War II.",2014,PG,113,"['thriller', 'drama', 'war']","['GB', 'US']",,tt2084970,8.0,756254.0,49.673,8.0,76789,Morten Tyldum
tm176864,Rush,MOVIE,A biographical drama centered on the rivalry between Formula 1 drivers James Hunt and Niki Lauda during the 1976 Formula One motor-racing season.,2013,R,123,"['drama', 'action', 'sport', 'european']","['US', 'DE', 'GB']",,tt1979320,8.1,471586.0,29.759,7.7,1324,Ron Howard
tm151663,Nightcrawler,MOVIE,"When Lou Bloom, desperate for work, muscles into the world of L.A. crime journalism, he blurs the line between observer and participant to become the star of his own story. Aiding him in his effort is Nina, a TV-news veteran.",2014,R,118,"['thriller', 'crime', 'drama']",['US'],,tt2872718,7.8,531779.0,57.276,7.7,45225,Dan Gilroy
tm145655,St. Vincent,MOVIE,"A young boy whose parents just divorced finds an unlikely friend and mentor in the misanthropic, bawdy, hedonistic, war veteran who lives next door.",2014,PG,102,"['comedy', 'drama']",['US'],,tt2170593,7.2,102820.0,18.905,7.1,7107,Theodore Melfi
tm160621,The Conjuring,MOVIE,"Paranormal investigators Ed and Lorraine Warren work to help a family terrorized by a dark presence in their farmhouse. Forced to confront a powerful entity, the Warrens find themselves caught in the most terrifying case of their lives.",2013,R,112,"['horror', 'thriller']",['US'],,tt1457767,7.5,496484.0,221.925,7.533,2709,James Wan
tm134967,How to Train Your Dragon 2,MOVIE,"Five years have passed since Hiccup and Toothless united the dragons and Vikings of Berk. Now, they spend their time charting unmapped territories. During one of their adventures, the pair discover a secret cave that houses hundreds of wild dragons -- and a mysterious dragon rider who turns out to be Hiccup's mother, Valka. Hiccup and Toothless then find themselves at the center of a battle to protect Berk from a power-hungry warrior named Drago.",2014,PG,102,"['action', 'animation', 'comedy', 'family', 'fantasy']",['US'],,tt1646971,7.8,330975.0,134.7,7.67,6895,Dean DeBlois
tm183523,Oldboy,MOVIE,An everyday man has only three and a half days and limited resources to discover why he was imprisoned in a nondescript room for 20 years without any explanation.,2013,R,104,"['action', 'drama', 'thriller']",['US'],,tt1321511,5.7,75728.0,20.164,5.9,31566,Spike Lee
tm148147,Big Eyes,MOVIE,"In the late 1950s and early '60s, artist Walter Keane achieves unbelievable fame and success with portraits of saucer-eyed waifs. However, no one realizes that his wife, Margaret, is the real painter behind the brush. Although Margaret is horrified to learn that Walter is passing off her work as his own, she is too meek to protest too loudly. It isn't until the Keanes' marriage comes to an end and a lawsuit follows that the truth finally comes to light.",2014,PG,106,"['drama', 'documentation', 'romance', 'crime']","['CA', 'US']",,tt1126590,7.2,51.0,11.98,6.998,8212,Tim Burton
tm143227,Begin Again,MOVIE,"Gretta, a budding songwriter, finds herself alone after her boyfriend Dave ditches her. Her life gains purpose when Dan, a record label executive, notices her talent.",2013,R,104,"['drama', 'comedy', 'music', 'romance']",['US'],,tt1980929,7.4,155249.0,15.514,7.254,41369,John Carney
tm169719,42,MOVIE,"The powerful story of Jackie Robinson, the legendary baseball player who broke Major League Baseball’s color barrier when he joined the roster of the Brooklyn Dodgers. The film follows the innovative Dodgers’ general manager Branch Rickey, the MLB executive who first signed Robinson to the minors and then helped to bring him up to the show.",2013,PG,128,"['drama', 'sport']",['US'],,tt0453562,7.5,94520.0,18.267,7.1,1246,Brian Helgeland
tm182429,Olympus Has Fallen,MOVIE,"When the White House (Secret Service Code: ""Olympus"") is captured by a terrorist mastermind and the President is kidnapped, disgraced former Presidential guard Mike Banning finds himself trapped within the building. As the national security team scrambles to respond, they are forced to rely on Banning's inside knowledge to help retake the White House, save the President and avert an even bigger disaster.",2013,R,120,"['action', 'thriller', 'drama']",['US'],,tt2302755,6.5,274270.0,55.607,6.4,3809,Antoine Fuqua
tm175843,Dark Skies,MOVIE,"From the producers of Paranormal Activity, Insidious, and Sinister comes Dark Skies: a supernatural thriller that follows a young family living in the suburbs. As husband and wife Daniel and Lacey Barret witness an escalating series of disturbing events involving their family, their safe and peaceful home quickly unravels. When it becomes clear that the Barret family is being targeted by an unimaginably terrifying and deadly force, Daniel and Lacey take matters in their own hands to solve the mystery of what is after their family.",2013,PG,97,"['scifi', 'thriller', 'horror', 'documentation']",['US'],,tt2387433,6.3,75663.0,22.342,6.3,1503,Scott Stewart
tm163686,Blue Jasmine,MOVIE,"After experiencing a traumatic misfortune, Jasmine French, a wealthy woman from New York, moves to San Francisco to live with her foster sister Ginger and the firm purpose of getting a new life, but she will be haunted by anxiety and memories of the past.",2013,PG,99,"['drama', 'comedy', 'european']",['US'],,tt2334873,7.3,201749.0,11.254,7.0,16172,Woody Allen
tm180572,Insidious: Chapter 2,MOVIE,The haunted Lambert family seeks to uncover the mysterious childhood secret that has left them dangerously connected to the spirit world.,2013,PG,106,"['horror', 'thriller']",['US'],,tt2226417,6.5,169039.0,68.55,6.7,2709,James Wan
tm151807,Creep,MOVIE,"Looking for work, Aaron comes across a cryptic online ad: “$1,000 for the day. Filming service. Discretion is appreciated.” Low on cash and full of naiveté, he decides to go for it. He drives to a cabin in a remote mountain town where he meets Josef, his cinematic subject for the day. Josef is sincere and the project seems heartfelt, so Aaron begins to film. But as the day goes on, it becomes clear that Josef is not who he says, and his intentions are not at all pure.",2014,R,82,"['horror', 'thriller']",['US'],,tt2428170,6.3,53408.0,16.301,6.4,36224,Patrick Brice
tm151764,Barefoot,MOVIE,"The ""black sheep"" son of a wealthy family meets a young psychiatric patient who's been raised in isolation her entire life. He takes the naive young woman home for his brother's wedding an improbable romance blooms, as she impresses everyone with her genuine, simple charms.",2014,PG,90,"['romance', 'comedy', 'drama']",['US'],,tt2355495,6.6,24167.0,9.2,6.6,40322,Andrew Fleming
tm153284,The Giver,MOVIE,"In a seemingly perfect community, without war, pain, suffering, differences or choice, a young boy is chosen to learn from an elderly man about the true pain and pleasure of the ""real"" world.",2014,PG,97,"['drama', 'scifi', 'thriller', 'romance']",['US'],,tt0435651,6.4,118877.0,17.987,6.5,6738,Phillip Noyce
tm165967,Mandela: Long Walk to Freedom,MOVIE,A chronicle of Nelson Mandela's life journey from his childhood in a rural village through to his inauguration as the first democratically elected president of South Africa.,2013,PG,141,"['drama', 'history']","['GB', 'ZA']",,tt2304771,7.1,27866.0,7.715,6.9,15873,Justin Chadwick
tm161525,The Green Inferno,MOVIE,"A group of student activists travel from New York City to the Amazon to save the rainforest.  However, once they arrive in this vast green landscape, they soon discover that they are not alone… and that no good deed goes unpunished.",2013,R,100,"['thriller', 'horror']","['US', 'CA', 'CL']",,tt2403021,5.3,44016.0,32.224,5.7,3042,Eli Roth
tm168400,Empire State,MOVIE,"After failing to get into the police academy, Chris Potamitis settles for a security guard job with an armoured truck company. After he makes the mistake of mentioning the company's lax security to his best friend, He's unwittingly drawn into an elaborate scheme to rob the abundant amounts of cash being stored on their premises—resulting in the largest cash heist in U.S.history.",2013,R,94,"['action', 'drama', 'crime', 'thriller', 'european']",['US'],,tt2171867,5.2,21538.0,39.273,5.4,32953,Dito Montiel
tm161282,Penguins of Madagascar,MOVIE,"Skipper, Kowalski, Rico and Private join forces with undercover organization The North Wind to stop the villainous Dr. Octavius Brine from destroying the world as we know it.",2014,PG,92,"['family', 'animation', 'action', 'comedy', 'scifi']",['US'],,tt1911658,6.6,89930.0,92.315,6.505,61501,Simon J. Smith
tm161282,Penguins of Madagascar,MOVIE,"Skipper, Kowalski, Rico and Private join forces with undercover organization The North Wind to stop the villainous Dr. Octavius Brine from destroying the world as we know it.",2014,PG,92,"['family', 'animation', 'action', 'comedy', 'scifi']",['US'],,tt1911658,6.6,89930.0,92.315,6.505,9235,Eric Darnell
tm148671,A Walk Among the Tombstones,MOVIE,Private investigator Matthew Scudder is hired by a drug kingpin to find out who kidnapped and murdered his wife.,2014,R,113,"['drama', 'thriller', 'action', 'crime']",['US'],,tt0365907,6.5,121232.0,67.95,6.309,9369,Scott Frank
tm171042,The Call,MOVIE,"Jordan Turner is an experienced 911 operator but when she makes an error in judgment and a call ends badly, Jordan is rattled and unsure if she can continue. But when teenager Casey Welson is abducted in the back of a man's car and calls 911, Jordan is the one called upon to use all of her experience, insights and quick thinking to help Casey escape, and not just to save her, but to make sure the man is brought to justice.",2013,R,94,"['thriller', 'crime', 'drama', 'horror', 'action', 'european']",['US'],,tt1911644,6.7,121843.0,41.764,6.8,589304,Brad Anderson
tm178712,Scary Movie 5,MOVIE,"Home with their newly-formed family, happy parents Dan and Jody are haunted by sinister, paranormal activities. Determined to expel the insidious force, they install security cameras and discover their family is being stalked by an evil dead demon.",2013,PG,89,"['comedy', 'horror']",['US'],,tt0795461,3.5,71405.0,122.985,4.8,20564,Malcolm D. Lee
tm187279,Philomena,MOVIE,"A woman searches for her adult son, who was taken away from her decades ago when she was forced to live in a convent.",2013,PG,97,"['drama', 'comedy', 'european']",['GB'],,tt2431286,7.6,99647.0,9.752,7.4,26809,Stephen Frears
tm165521,Redemption,MOVIE,"Homeless and on the run from a military court martial, a damaged ex-special forces soldier navigating London's criminal underworld seizes an opportunity to assume another man's identity, transforming into an avenging angel in the process.",2013,R,100,"['action', 'thriller', 'european']","['US', 'GB']",,,,,52.251,6.2,5397,Steven Knight
tm141648,Seventh Son,MOVIE,"John Gregory, who is a seventh son of a seventh son and also the local spook, has protected the country from witches, boggarts, ghouls and all manner of things that go bump in the night. However John is not young anymore, and has been seeking an apprentice to carry on his trade. Most have failed to survive. The last hope is a young farmer's son named Thomas Ward. Will he survive the training to become the spook that so many others couldn't?",2014,PG,102,"['action', 'fantasy']","['US', 'GB', 'CN', 'CA']",,tt1121096,5.5,76939.0,45.215,5.5,7140,Sergei Bodrov
tm176630,The Butler,MOVIE,"A look at the life of Cecil Gaines who served eight presidents as the White House's head butler from 1952 to 1986, and had a unique front-row seat as political and racial history was made.",2013,PG,132,"['drama', 'european']",['US'],,tt1327773,7.2,114768.0,15.115,7.355,24777,Lee Daniels
tm184608,Texas Chainsaw 3D,MOVIE,"A young woman learns that she has inherited a Texas estate from her deceased grandmother. After embarking on a road trip with friends to uncover her roots, she finds she is the sole owner of a lavish, isolated Victorian mansion. But her newfound wealth comes at a price as she stumbles upon a horror that awaits her in the mansion’s dank cellars.",2013,R,87,"['thriller', 'horror']",['US'],,tt1572315,4.8,49312.0,53.401,5.4,13150,John Luessenhop
tm187979,Cloudy with a Chance of Meatballs 2,MOVIE,"After the disastrous food storm in the first film, Flint and his friends are forced to leave the town. Flint accepts the invitation from his idol Chester V to join The Live Corp Company, which has been tasked to clean the island, and where the best inventors in the world create technologies for the betterment of mankind. When Flint discovers that his machine still operates and now creates mutant food beasts like living pickles, hungry tacodiles, shrimpanzees and apple pie-thons, he and his friends must return to save the world.",2013,PG,95,"['animation', 'scifi', 'drama', 'comedy', 'family', 'fantasy']",['US'],,tt1985966,6.3,102071.0,64.17,6.443,14239,Kris Pearn
tm187979,Cloudy with a Chance of Meatballs 2,MOVIE,"After the disastrous food storm in the first film, Flint and his friends are forced to leave the town. Flint accepts the invitation from his idol Chester V to join The Live Corp Company, which has been tasked to clean the island, and where the best inventors in the world create technologies for the betterment of mankind. When Flint discovers that his machine still operates and now creates mutant food beasts like living pickles, hungry tacodiles, shrimpanzees and apple pie-thons, he and his friends must return to save the world.",2013,PG,95,"['animation', 'scifi', 'drama', 'comedy', 'family', 'fantasy']",['US'],,tt1985966,6.3,102071.0,64.17,6.443,5663,Cody Cameron
tm171228,Metallica: Through the Never,MOVIE,"Trip, a young roadie for Metallica, is sent on an urgent mission during the band's show. But what seems like a simple assignment turns into a surreal adventure.",2013,R,93,['music'],['US'],,tt2172935,7.1,17513.0,14.231,6.8,14094,Nimród Antal
tm161029,Mr. Peabody & Sherman,MOVIE,"A young boy and his dog, who happens to have a genius-level IQ, spring into action when their time-machine is stolen and moments in history begin to be changed.",2014,PG,92,"['action', 'family', 'animation', 'romance', 'comedy', 'fantasy', 'history', 'scifi']",['US'],,tt0864835,6.8,69669.0,37.533,6.7,20437,Rob Minkoff
