id,title,type,description,release_year,age_certification,runtime,genres,production_countries,seasons,imdb_id,imdb_score,imdb_votes,tmdb_popularity,tmdb_score,person_id,name
tm84618,Taxi Driver,MOVIE,A mentally unstable Vietnam War veteran works as a night-time taxi driver in New York City where the perceived decadence and sleaze feed his urge for violent action.,1976,R,114,"['drama', 'crime']",['US'],,tt0075314,8.2,808582.0,40.965,8.179,3308,Martin Scorsese
tm154986,Deliverance,MOVIE,"Intent on seeing the Cahulawassee River before it's turned into one huge lake, outdoor fanatic Lewis Medlock takes his friends on a river-rafting trip they'll never forget into the dangerous American back-country.",1972,R,109,"['drama', 'action', 'thriller', 'european']",['US'],,tt0068473,7.7,107673.0,10.01,7.3,17727,John Boorman
tm127384,Monty Python and the Holy Grail,MOVIE,"King Arthur, accompanied by his squire, recruits his Knights of the Round Table, including Sir Bedevere the Wise, Sir Lancelot the Brave, Sir Robin the Not-Quite-So-Brave-As-Sir-Lancelot and Sir Galahad the Pure. On the way, Arthur battles the Black Knight who, despite having had all his limbs chopped off, insists he can still fight. They reach Camelot, but Arthur decides not  to enter, as ""it is a silly place"".",1975,PG,91,"['fantasy', 'action', 'comedy']",['GB'],,tt0071853,8.2,534486.0,15.461,7.811,11475,Terry Jones
tm127384,Monty Python and the Holy Grail,MOVIE,"King Arthur, accompanied by his squire, recruits his Knights of the Round Table, including Sir Bedevere the Wise, Sir Lancelot the Brave, Sir Robin the Not-Quite-So-Brave-As-Sir-Lancelot and Sir Galahad the Pure. On the way, Arthur battles the Black Knight who, despite having had all his limbs chopped off, insists he can still fight. They reach Camelot, but Arthur decides not  to enter, as ""it is a silly place"".",1975,PG,91,"['fantasy', 'action', 'comedy']",['GB'],,tt0071853,8.2,534486.0,15.461,7.811,11473,Terry Gilliam
tm70993,Life of Brian,MOVIE,"Brian Cohen is an average young Jewish man, but through a series of ridiculous events, he gains a reputation as the Messiah. When he's not dodging his followers or being scolded by his shrill mother, the hapless Brian has to contend with the pompous Pontius Pilate and acronym-obsessed members of a separatist movement. Rife with Monty Python's signature absurdity, the tale finds Brian's life paralleling Biblical lore, albeit with many more laughs.",1979,R,94,['comedy'],['GB'],,tt0079470,8.0,395024.0,17.77,7.8,11475,Terry Jones
tm14873,Dirty Harry,MOVIE,"When a madman dubbed 'Scorpio' terrorizes San Francisco, hard-nosed cop, Harry Callahan – famous for his take-no-prisoners approach to law enforcement – is tasked with hunting down the psychopath. Harry eventually collars Scorpio in the process of rescuing a kidnap victim, only to see him walk on technicalities. Now, the maverick detective is determined to nail the maniac himself.",1971,R,102,"['thriller', 'action', 'crime']",['US'],,tt0066999,7.7,155051.0,12.817,7.5,56405,Don Siegel
tm119281,Bonnie and Clyde,MOVIE,"In the 1930s, bored waitress Bonnie Parker falls in love with an ex-con named Clyde Barrow and together they start a violent crime spree through the country, stealing cars and robbing banks.",1967,R,110,"['crime', 'drama', 'action']",['US'],,tt0061418,7.7,112048.0,15.687,7.5,22355,Arthur Penn
tm98978,The Blue Lagoon,MOVIE,"Two small children and a ship's cook survive a shipwreck and find safety on an idyllic tropical island. Soon, however, the cook dies and the young boy and girl are left on their own. Days become years and Emmeline and Richard make a home for themselves surrounded by exotic creatures and nature's beauty. But will they ever see civilization again?",1980,R,104,"['romance', 'action', 'drama']",['US'],,tt0080453,5.8,69844.0,50.324,6.156,28692,Randal Kleiser
tm67378,The Professionals,MOVIE,An arrogant Texas millionaire hires four adventurers to rescue his kidnapped wife from a notorious Mexican bandit.,1966,PG,117,"['western', 'action', 'european']",['US'],,tt0060862,7.3,16446.0,13.123,7.1,23705,Richard Brooks
tm69997,Richard Pryor: Live in Concert,MOVIE,"Richard Pryor delivers monologues on race, sex, family and his favorite target—himself, live at the Terrace Theatre in Long Beach, California.",1979,R,78,"['comedy', 'documentation']",['US'],,tt0079807,8.1,5141.0,4.718,7.5,65063,Jeff Margolis
tm89386,Hitler: A Career,MOVIE,"A keen chronicle of the unlikely rise to power of Adolf Hitler (1889-1945) and a dissection of the Third Reich (1933-1945), but also an analysis of mass psychology and how the desperate crowd can be deceived and shepherded to the slaughterhouse.",1977,PG,150,"['history', 'documentation', 'european']",['DE'],,tt0191182,7.5,2460.0,4.305,7.3,41187,Joachim Fest
tm156453,FTA,MOVIE,"A documentary about a political troupe headed by actors Jane Fonda and Donald Sutherland which traveled to towns near military bases in the US in the early 1970s. The group put on shows called ""F.T.A."", which stood for ""F**k the Army"", and was aimed at convincing soldiers to voice their opposition to the Vietnam War, which was raging at the time. Various singers, actors and other entertainers performed antiwar songs and skits during the show.",1972,R,97,"['war', 'documentation', 'music', 'comedy']",['US'],,tt0068562,6.2,418.0,1.268,6.1,529468,Francine Parker
tm155787,GoodFellas,MOVIE,"The true story of Henry Hill, a half-Irish, half-Sicilian Brooklyn kid who is adopted by neighbourhood gangsters at an early age and climbs the ranks of a Mafia family under the guidance of Jimmy Conway.",1990,R,145,"['drama', 'crime']",['US'],,tt0099685,8.7,1131681.0,50.387,8.463,3308,Martin Scorsese
tm22327,Full Metal Jacket,MOVIE,A pragmatic U.S. Marine observes the dehumanizing effects the U.S.-Vietnam War has on his fellow recruits from their brutal boot camp training to the bloody street fighting in Hue.,1987,R,117,"['war', 'drama']","['US', 'GB']",,tt0093058,8.3,729274.0,32.937,8.1,21108,Stanley Kubrick
tm180542,Once Upon a Time in America,MOVIE,"A former Prohibition-era Jewish gangster returns to the Lower East Side of Manhattan over thirty years later, where he once again must confront the ghosts and regrets of his old life.",1984,R,139,"['crime', 'drama', 'european']","['US', 'IT']",,tt0087843,8.3,345714.0,28.937,8.453,37242,Sergio Leone
tm138875,When Harry Met Sally...,MOVIE,"During their travel from Chicago to New York, Harry and Sally debate whether or not sex ruins a friendship between a man and a woman. Eleven years later, and they're still no closer to finding the answer.",1989,R,96,"['comedy', 'romance', 'drama']",['US'],,tt0098635,7.7,216199.0,15.123,7.4,224,Rob Reiner
tm2386,A Nightmare on Elm Street,MOVIE,"Teenagers in a small town are dropping like flies, apparently in the grip of mass hysteria causing their suicides. A cop's daughter, Nancy Thompson, traces the cause to child molester Fred Krueger, who was burned alive by angry parents many years before. Krueger has now come back in the dreams of his killers' children, claiming their lives as his revenge. Nancy and her boyfriend, Glen, must devise a plan to lure the monster out of the realm of nightmares and into the real world...",1984,R,91,['horror'],"['GB', 'US']",,tt0087800,7.4,234068.0,48.358,7.3,925,Wes Craven
tm133087,Steel Magnolias,MOVIE,"A young beautician, newly arrived in a small Louisiana town, finds work at the local salon, where a small group of women share a close bond of friendship and welcome her into the fold.",1989,PG,119,"['comedy', 'drama', 'romance']",['US'],,tt0098384,7.3,54946.0,11.69,7.2,45795,Herbert Ross
tm177480,Police Academy,MOVIE,"New rules enforced by the Lady Mayoress mean that sex, weight, height and intelligence need no longer be a factor for joining the Police Force. This opens the floodgates for all and sundry to enter the Police Academy, much to the chagrin of the instructors. Not everyone is there through choice, though. Social misfit Mahoney has been forced to sign up as the only alternative to a jail sentence and it doesn't take long before he falls foul of the boorish Lieutenant Harris. But before long, Mahoney realises that he is enjoying being a police cadet and decides he wants to stay... while Harris decides he wants Mahoney out!",1984,R,97,"['crime', 'comedy']",['US'],,tt0087928,6.7,124881.0,25.533,6.6,27046,Hugh Wilson
tm54450,Christine,MOVIE,"Geeky student Arnie Cunningham falls for Christine, a rusty 1958 Plymouth Fury, and becomes obsessed with restoring the classic automobile to her former glory. As the car changes, so does Arnie, whose newfound confidence turns to arrogance behind the wheel of his exotic beauty. Arnie's girlfriend Leigh and best friend Dennis reach out to him, only to be met by a Fury like no other.",1983,R,110,"['horror', 'thriller', 'european']",['US'],,tt0085333,6.7,81922.0,23.418,6.8,12968,John Carpenter
tm145608,Awakenings,MOVIE,"Dr. Malcolm Sayer, a shy research physician, uses an experimental drug to ""awaken"" the catatonic victims of a rare disease. Leonard is the first patient to receive the controversial treatment. His awakening, filled with awe and enthusiasm, proves a rebirth for Sayer too, as the exuberant patient reveals life's simple but unutterably sweet pleasures to the introverted doctor.",1990,PG,120,"['drama', 'european']",['US'],,tt0099077,7.8,139240.0,12.23,7.8,18924,Penny Marshall
tm147710,National Lampoon's Christmas Vacation,MOVIE,"It's Christmastime, and the Griswolds are preparing for a family seasonal celebration. But things never run smoothly for Clark, his wife Ellen, and their two kids. Clark's continual bad luck is worsened by his obnoxious family guests, but he manages to keep going, knowing that his Christmas bonus is due soon.",1989,PG,97,"['comedy', 'european']",['US'],,tt0097958,7.5,185760.0,18.862,7.2,12814,Jeremiah S. Chechik
tm142895,Lean On Me,MOVIE,"When principal Joe Clark takes over decaying Eastside High School, he's faced with students wearing gang colors and graffiti-covered walls. Determined to do anything he must to turn the school around, he expels suspected drug dealers, padlocks doors and demands effort and results from students, staff and parents. Autocratic to a fault, this real-life educator put it all on the line.",1989,PG,105,['drama'],['US'],,tt0097722,7.4,20680.0,19.449,7.3,7782,John G. Avildsen
tm20712,Eddie Murphy Raw,MOVIE,"Eddie Murphy delights, shocks and entertains with dead-on celebrity impersonations, observations on '80s love, sex and marriage, a remembrance of Mom's hamburgers and much more.",1987,R,90,"['comedy', 'documentation']",['US'],,tt0092948,7.6,19757.0,7.992,7.3,73538,Robert Townsend
tm117580,She's Gotta Have It,MOVIE,"The story of Nola Darling's simultaneous sexual relationships with three different men is told by her and by her partners and other friends. All three men wanted her to commit solely to them; Nola resists being ""owned"" by a single partner.",1986,R,84,"['romance', 'comedy']",['US'],,tt0091939,6.7,14472.0,7.416,6.707,31566,Spike Lee
tm130586,Endless Love,MOVIE,"Two young kids fall in love with each other. But the passion is too consuming for the parents of Jade. The parents try to stop them from seeing each other. But when this doesn't work, David burns down the house and is sent away. This doesn't stop him from seeing her. When he gets out he goes to look for her. But the passion for his first love is too strong and she has to leave.",1981,R,116,"['romance', 'drama']",['US'],,tt0082329,4.9,8524.0,19.116,5.7,32357,Franco Zeffirelli
ts2760,Fireman Sam,SHOW,"Follow the adventures of fireman Sam and his colleagues as they protect the citizens of the Welsh town of Pontypandy. Whenever the alarm sounds, brave Sam and his co-workers can be counted on to jump into a fire engine, hop onto a helicopter, or even launch an inflatable lifeboat to battle blazes, mount rescue missions, or provide medical attention to those in need.",1987,G,10,"['animation', 'comedy', 'family', 'crime', 'european']",['GB'],13.0,tt0329829,6.1,1785.0,37.647,7.2,277353,Gary Andrews
tm21953,Sam Kinison: Breaking the Rules,MOVIE,"This is a great performance. Through yelling and energetic story-telling, he talks about marriage, drugs, being arrested (thanks to his ex-wife), pleasing women, religion, and much, much more.",1987,R,50,"['comedy', 'documentation']",['US'],,tt0307403,7.2,660.0,1.843,7.2,128365,Walter C. Miller
tm62924,Monty Python Live at the Hollywood Bowl,MOVIE,"Monty Python perform many of their greatest sketches at the Hollywood Bowl, including several from pre-Python days.",1982,R,81,"['comedy', 'documentation']",['GB'],,tt0084352,7.9,15230.0,6.833,7.4,64700,Terry Hughes
tm62924,Monty Python Live at the Hollywood Bowl,MOVIE,"Monty Python perform many of their greatest sketches at the Hollywood Bowl, including several from pre-Python days.",1982,R,81,"['comedy', 'documentation']",['GB'],,tt0084352,7.9,15230.0,6.833,7.4,16383,Ian MacNaughton
tm132164,Bill Hicks: Sane Man,MOVIE,"Sane Man was filmed before Bill recorded ‘Dangerous’, his first comedy album, and is a turning point in Hicks’ career. It was the first complete Hicks show ever filmed and Bill pulled out all the stops for the cameras. Completely focused, a newly-sober Hicks paces the stage like a wild animal riffing effortless.",1989,R,80,['comedy'],['US'],,,,,3.377,7.5,354120,Kevin Booth
tm132164,Bill Hicks: Sane Man,MOVIE,"Sane Man was filmed before Bill recorded ‘Dangerous’, his first comedy album, and is a turning point in Hicks’ career. It was the first complete Hicks show ever filmed and Bill pulled out all the stops for the cameras. Completely focused, a newly-sober Hicks paces the stage like a wild animal riffing effortless.",1989,R,80,['comedy'],['US'],,,,,3.377,7.5,484289,David Johndrow
tm107744,Mission: Impossible,MOVIE,"When Ethan Hunt, the leader of a crack espionage team whose perilous operation has gone awry with no explanation, discovers that a mole has penetrated the CIA, he's surprised to learn that he's the No. 1 suspect. To clear his name, Hunt now must ferret out the real double agent and, in the process, even the score.",1996,PG,110,"['thriller', 'action']",['US'],,tt0117060,7.1,420673.0,41.115,6.9,11594,Brian De Palma
tm15897,Se7en,MOVIE,"Two homicide detectives are on a desperate hunt for a serial killer whose crimes are based on the ""seven deadly sins"" in this dark and haunting film that takes viewers from the tortured remains of one victim to the next. The seasoned Det. Sommerset researches each sin in an effort to get inside the killer's mind, while his novice partner, Mills, scoffs at his efforts to unravel the case.",1995,R,127,"['crime', 'thriller', 'drama']",['US'],,tt0114369,8.6,1606270.0,51.633,8.352,2964,David Fincher
tm191013,Boogie Nights,MOVIE,"Set in 1977, back when sex was safe, pleasure was a business and business was booming, idealistic porn producer Jack Horner aspires to elevate his craft to an art form. Horner discovers Eddie Adams, a hot young talent working as a busboy in a nightclub, and welcomes him into the extended family of movie-makers, misfits and hangers-on that are always around. Adams' rise from nobody to a celebrity adult entertainer is meteoric, and soon the whole world seems to know his porn alter ego, ""Dirk Diggler"". Now, when disco and drugs are in vogue, fashion is in flux and the party never seems to stop, Adams' dreams of turning sex into stardom are about to collide with cold, hard reality.",1997,R,156,['drama'],['US'],,tt0118749,7.9,261563.0,20.436,7.6,13025,Paul Thomas Anderson
tm122434,Forrest Gump,MOVIE,"A man with a low IQ has accomplished great things in his life and been present during significant historic events—in each case, far exceeding what anyone imagined he could do. But despite all he has achieved, his one true love eludes him.",1994,PG,142,"['drama', 'romance']",['US'],,tt0109830,8.8,2021343.0,63.449,8.478,3238,Robert Zemeckis
tm25947,Snatch,MOVIE,"Unscrupulous boxing promoters, violent bookmakers, a Russian gangster, incompetent amateur robbers and supposedly Jewish jewelers fight to track down a priceless stolen diamond.",2000,R,103,"['crime', 'comedy']","['US', 'GB']",,tt0208092,8.3,841435.0,25.203,7.8,4505,Guy Ritchie
tm43808,The Talented Mr. Ripley,MOVIE,"Tom Ripley is a calculating young man who believes it's better to be a fake somebody than a real nobody. Opportunity knocks in the form of a wealthy U.S. shipbuilder who hires Tom to travel to Italy to bring back his playboy son, Dickie. Ripley worms his way into the idyllic lives of Dickie and his girlfriend, plunging into a daring scheme of duplicity, lies and murder.",1999,R,139,"['thriller', 'drama', 'crime']",['US'],,tt0134119,7.4,207524.0,13.78,7.2,15245,Anthony Minghella
tm191110,Titanic,MOVIE,"101-year-old Rose DeWitt Bukater tells the story of her life aboard the Titanic, 84 years later. A young Rose boards the ship with her mother and fiancé. Meanwhile, Jack Dawson and Fabrizio De Rossi win third-class tickets aboard the ship. Rose tells the whole story from Titanic's departure through to its death—on its first and last voyage—on April 15, 1912.",1997,PG,194,"['drama', 'romance']",['US'],,tt0120338,7.9,1146825.0,155.683,7.878,3156,James Cameron
tm192037,Starship Troopers,MOVIE,"Set in the future, the story follows a young soldier named Johnny Rico and his exploits in the Mobile Infantry. Rico's military career progresses from recruit to non-commissioned officer and finally to officer against the backdrop of an interstellar war between mankind and an arachnoid species known as ""the Bugs"".",1997,R,129,"['scifi', 'action', 'thriller']",['US'],,tt0120201,7.3,291452.0,29.5,6.993,10468,Paul Verhoeven
tm27395,Mission: Impossible II,MOVIE,"With computer genius Luther Stickell at his side and a beautiful thief on his mind, agent Ethan Hunt races across Australia and Spain to stop a former IMF agent from unleashing a genetically engineered biological weapon called Chimera. This mission, should Hunt choose to accept it, plunges him into the center of an international crisis of terrifying magnitude.",2000,PG,123,"['thriller', 'action']",['US'],,tt0120755,6.1,337987.0,29.392,6.1,8673,John Woo
tm113513,Dumb and Dumber,MOVIE,"Lloyd and Harry are two men whose stupidity is really indescribable. When Mary, a beautiful woman, loses an important suitcase with money before she leaves for Aspen, the two friends (who have found the suitcase) decide to return it to her. After some ""adventures"" they finally get to Aspen where, using the lost money they live it up and fight for Mary's heart.",1994,PG,107,['comedy'],['US'],,tt0109686,7.3,379999.0,31.852,6.6,6341,Peter Farrelly
tm192405,Gattaca,MOVIE,"In a future society in the era of indefinite eugenics, humans are set on a life course depending on their DNA. Young Vincent Freeman is born with a condition that would prevent him from space travel, yet is determined to infiltrate the GATTACA space program.",1997,PG,106,"['scifi', 'thriller', 'romance', 'drama']",['US'],,tt0119177,7.8,300701.0,17.789,7.553,9310,Andrew Niccol
tm116655,Léon: The Professional,MOVIE,"Léon, the top hit man in New York, has earned a rep as an effective ""cleaner"". But when his next-door neighbors are wiped out by a loose-cannon DEA agent, he becomes the unwilling custodian of 12-year-old Mathilda. Before long, Mathilda's thoughts turn to revenge, and she considers following in Léon's footsteps.",1994,R,111,"['crime', 'drama', 'action', 'thriller', 'european']","['US', 'FR']",,tt0110413,8.5,1137357.0,51.406,8.323,977,Luc Besson
tm116488,Natural Born Killers,MOVIE,Two victims of traumatized childhoods become lovers and serial murderers irresponsibly glorified by the mass media.,1994,R,118,"['thriller', 'drama', 'crime', 'action']",['US'],,tt0110632,7.3,11.0,21.933,7.1,13763,Oliver Stone
tm11556,The Quick and the Dead,MOVIE,"A mysterious woman comes to compete in a quick-draw elimination tournament, in a town taken over by a notorious gunman.",1995,R,107,"['action', 'thriller', 'western', 'romance']","['JP', 'US']",,tt0114214,6.5,93767.0,13.056,6.5,6591,Sam Raimi
tm56574,You've Got Mail,MOVIE,"Book superstore magnate, Joe Fox and independent book shop owner, Kathleen Kelly fall in love in the anonymity of the Internet—both blissfully unaware that he's trying to put her out of business.",1998,PG,119,"['comedy', 'romance', 'drama']",['US'],,tt0128853,6.7,211635.0,21.724,6.643,223,Nora Ephron
tm53991,Big Daddy,MOVIE,"A lazy law school grad adopts a kid to impress his girlfriend, but everything doesn't go as planned and he becomes the unlikely foster father.",1999,PG,93,"['drama', 'comedy', 'european']",['US'],,tt0142342,6.4,215053.0,26.848,6.45,8969,Dennis Dugan
tm49178,Vampires,MOVIE,The church enlists a team of vampire-hunters to hunt down and destroy a group of vampires searching for an ancient relic that will allow them to exist in sunlight.,1998,R,104,"['fantasy', 'action', 'horror', 'thriller']",['US'],,tt0120877,6.1,58670.0,10.108,6.3,12968,John Carpenter
tm191989,Donnie Brasco,MOVIE,An FBI undercover agent infilitrates the mob and finds himself identifying more with the mafia life at the expense of his regular one.,1997,R,127,"['drama', 'thriller', 'crime']",['US'],,tt0119008,7.7,303868.0,22.225,7.5,9898,Mike Newell
ts21034,InuYasha,SHOW,"Kagome Higurashi is a modern day young girl who lives with her family by the old Higure shrine. Unbeknownst to Kagome, she is the reincarnation of priestess Kikyo and posseses the ""Jewel of Four Souls"" (the Shikon jewel). One ill-fated day, Kagome locates an ancient well near her home and is abruptly transported through the well and into a feudal Japan, inhabited by demons. There, she encounters Inuyasha, son of a powerful demon father and a human mother, who is pinned to a tree by an enchanted arrow.",2000,PG,25,"['scifi', 'action', 'fantasy', 'romance', 'animation', 'comedy', 'drama']",['JP'],9.0,tt0290223,7.9,15823.0,62.355,8.6,115792,Yasunao Aoki
ts21034,InuYasha,SHOW,"Kagome Higurashi is a modern day young girl who lives with her family by the old Higure shrine. Unbeknownst to Kagome, she is the reincarnation of priestess Kikyo and posseses the ""Jewel of Four Souls"" (the Shikon jewel). One ill-fated day, Kagome locates an ancient well near her home and is abruptly transported through the well and into a feudal Japan, inhabited by demons. There, she encounters Inuyasha, son of a powerful demon father and a human mother, who is pinned to a tree by an enchanted arrow.",2000,PG,25,"['scifi', 'action', 'fantasy', 'romance', 'animation', 'comedy', 'drama']",['JP'],9.0,tt0290223,7.9,15823.0,62.355,8.6,200167,Masashi Ikeda
tm121879,A River Runs Through It,MOVIE,"A River Runs Through is a cinematographically stunning true story of Norman Maclean. The story follows Norman and his brother Paul through the experiences of life and growing up, and how their love of fly fishing keeps them together despite varying life circumstances in the untamed west of Montana in the 1920's.",1992,PG,123,['drama'],['US'],,tt0105265,7.2,59854.0,19.58,7.1,11605,Robert Redford
tm44402,"Girl, Interrupted",MOVIE,"Set in the changing world of the late 1960s, Susanna Kaysen's prescribed ""short rest"" from a psychiatrist she had met only once becomes a strange, unknown journey into Alice's Wonderland, where she struggles with the thin line between normal and crazy. Susanna soon realizes how hard it is to get out once she has been committed, and she ultimately has to choose between the world of people who belong inside or the difficult world of reality outside.",1999,R,127,"['drama', 'european']","['DE', 'US']",,tt0172493,7.3,183154.0,20.424,7.6,18526,James Mangold
tm187187,Last Action Hero,MOVIE,"Following the death of his father, young Danny Madigan takes comfort in watching action movies featuring the indestructible Los Angeles cop Jack Slater. After being given a magic ticket by theater manager Nick, Danny is sucked into the screen and bonds with Slater. When evil fictional villain Benedict gets his hands on the ticket and enters the real world, Danny and Jack must follow and stop him.",1993,PG,131,"['action', 'fantasy', 'comedy', 'family']",['US'],,tt0107362,6.4,150498.0,22.196,6.379,4381,John McTiernan
tm6859,My Girl,MOVIE,"Vada Sultenfuss is obsessed with death. Her mother is dead, and her father runs a funeral parlor. She is also in love with her English teacher, and joins a poetry class over the summer just to impress him. Thomas J., her best friend, is ""allergic to everything"", and sticks with Vada despite her hangups. When Vada's father hires Shelly, and begins to fall for her, things take a turn to the worse...",1991,PG,103,"['drama', 'family', 'romance', 'comedy', 'european']",['US'],,tt0102492,6.9,80590.0,20.545,7.4,58278,Howard Zieff
tm118238,Wyatt Earp,MOVIE,"Covering the life and times of one of the West's most iconic heroes Wyatt Earp weaves an intricate tale of Earp and his friends and family. With a star studded cast, sweeping cinematography and authentic costumes Wyatt Earp led the way during the Western revival in the 90's.",1994,PG,191,"['western', 'crime', 'action', 'drama']",['US'],,tt0111756,6.7,50774.0,14.677,6.751,21313,Lawrence Kasdan
tm111163,Eraser,MOVIE,"U.S. Marshall John Kruger erases the identities of people enrolled in the Witness Protection Program. His current assignment is to protect Lee Cullen, who's uncovered evidence that the weapons manufacturer she works for has been selling to terrorist groups. When Kruger discovers that there's a corrupt agent within the program, he must guard his own life while trying to protect Lee's.",1996,R,115,"['thriller', 'action', 'drama', 'crime']","['US', 'CA']",,tt0116213,6.1,110921.0,19.437,6.0,1516,Chuck Russell
